oa_funder_id,oa_funder_name
https://openalex.org/F4320336377,"Marine Equipment and Technology Institute, Jiangsu University of Science and Technology"
https://openalex.org/F4320327827,Key Research and Development Project of Hainan Province
https://openalex.org/F4320320351,Commonwealth Scholarship Commission
https://openalex.org/F4320336061,Research England
https://openalex.org/F4320334971,Science and Engineering Research Council
https://openalex.org/F4320327099,Support Program for Longyuan Youth and Fundamental Research Funds for the Universities of Gansu Province
https://openalex.org/F4320330453,"Collaborative Innovation Center for Particles and Interactions, USTC"
https://openalex.org/F4320326913,State Key Laboratory of Luminescent Materials and Devices
https://openalex.org/F4320322429,Northeastern University
https://openalex.org/F4320310114,Zhongnan University of Economics and Law
https://openalex.org/F4320325900,Gansu Education Department
https://openalex.org/F4320329179,Longdong University
https://openalex.org/F4320329889,Henan Province Science and Technology Innovation Talent Program
https://openalex.org/F4320328381,Huxiang Youth Talent Support Program
https://openalex.org/F4320338465,Zhejiang Province Public Welfare Technology Application Research Project
https://openalex.org/F4320316140,Energi Simulation
https://openalex.org/F4320327462,Wuhan Textile University
https://openalex.org/F4320336023,Program for Professor of Special Appointment (Eastern Scholar) at Shanghai Institutions of Higher Learning
https://openalex.org/F4320329857,Major Scientific and Technological Innovation Project of Shandong Province
https://openalex.org/F4320336593,Henan Provincial Science and Technology Research Project
https://openalex.org/F4320336817,Science Fund for Distinguished Young Scholars of Hebei Province
https://openalex.org/F4320322701,Tianjin University
https://openalex.org/F4320327008,Key Laboratory of Optoelectronic Chemical Materials and Devices
https://openalex.org/F4320336823,Science Fund for Distinguished Young Scholars of Tianjin
https://openalex.org/F4320311826,Chengdu University of Information Technology
https://openalex.org/F4320336596,Key Research and Development Program of Sichuan Province
https://openalex.org/F4320327282,Department of Science and Technology of Jilin Province
https://openalex.org/F4320325186,Northeast Agricultural University
https://openalex.org/F4320327359,Kaohsiung Veterans General Hospital
https://openalex.org/F4320327650,Ditmanson Medical Foundation Chia-Yi Christian Hospital
https://openalex.org/F4320338290,National Renewable Energy Laboratory
https://openalex.org/F4320322370,East China Normal University
https://openalex.org/F4320309480,Nvidia
https://openalex.org/F4320332999,Horizon 2020 Framework Programme
https://openalex.org/F4320338279,Air Force Office of Scientific Research
https://openalex.org/F4320306108,U.S. Department of Transportation
https://openalex.org/F4320326441,Institute for Basic Science
https://openalex.org/F4320321373,Korea University
https://openalex.org/F4320321652,Eidgenössische Technische Hochschule Zürich
https://openalex.org/F4320335015,Bundesamt für Energie
https://openalex.org/F4320321884,Shanxi Scholarship Council of China
https://openalex.org/F4320327253,Novo Nordisk Foundation Center for Basic Metabolic Research
https://openalex.org/F4320322581,Vetenskapsrådet
https://openalex.org/F4320322711,Energimyndigheten
https://openalex.org/F4320326021,Stiftelsen Åforsk
https://openalex.org/F4320331685,University of Hong Kong-Shenzhen Hospital
https://openalex.org/F4320336479,"Geological Research Institute for Coal Green Mining, Xi'an University of Science and Technology"
https://openalex.org/F4320329174,Shenzhen Municipal Science and Technology Innovation Council
https://openalex.org/F4320311213,Education Department of Hunan Province
https://openalex.org/F4320329842,Guangdong Provincial People's Hospital
https://openalex.org/F4320327806,Tip-top Scientific and Technical Innovative Youth Talents of Guangdong Special Support Program
https://openalex.org/F4320322183,Huawei Technologies
https://openalex.org/F4320326667,Bureau of Education of Guangzhou Municipality
https://openalex.org/F4320326846,State Key Laboratory of Polymer Physics and Chemistry
https://openalex.org/F4320330193,Chinese Academy of Engineering
https://openalex.org/F4320335647,"Key Laboratory of Engineering Plastics, Chinese Academy of Sciences"
https://openalex.org/F4320322108,Ministry of Science and Technology
https://openalex.org/F4320323299,Norges Forskningsråd
https://openalex.org/F4320306196,Welch Foundation
https://openalex.org/F4320310133,Rice University
https://openalex.org/F4320332359,Office of Science
https://openalex.org/F4320337547,Laboratory Directed Research and Development
https://openalex.org/F4320338284,Argonne National Laboratory
https://openalex.org/F4320326957,Chongqing Jiaotong University
https://openalex.org/F4320310017,University of Connecticut
https://openalex.org/F4320335960,National Major Science and Technology Projects of China
https://openalex.org/F4320317145,National Engineering and Research Center for Commercial Aircraft Manufacturing
https://openalex.org/F4320332950,Shanghai Aircraft Manufacturing Company
https://openalex.org/F4320324854,University of Shanghai for Science and Technology
https://openalex.org/F4320327222,Korea Institute of Marine Science and Technology promotion
https://openalex.org/F4320325266,Chung Shan Medical University
https://openalex.org/F4320326719,Drainage Services Department
https://openalex.org/F4320322766,Zhengzhou University
https://openalex.org/F4320336620,Shanghai Shuguang Program
https://openalex.org/F4320319616,Japan Petroleum Institute
https://openalex.org/F4320334630,Economic and Social Research Council
https://openalex.org/F4320328578,BHP
https://openalex.org/F4320316084,China Computer Federation
https://openalex.org/F4320306518,Spencer Foundation
https://openalex.org/F4320309102,City University of New York
https://openalex.org/F4320332202,Research Foundation of The City University of New York
https://openalex.org/F4320335636,"Key Laboratory of Fluid and Power Machinery, Ministry of Education"
https://openalex.org/F4320336024,Specialized Research Fund for the Doctoral Program of Higher Education of China
https://openalex.org/F4320338468,Basic Public Welfare Research Program of Zhejiang Province
https://openalex.org/F4320324130,Yangzhou University
https://openalex.org/F4320325365,University of Science and Technology Beijing
https://openalex.org/F4320322880,Natural Science Foundation of Gansu Province
https://openalex.org/F4320334811,Changchun Institute of Applied Chemistry
https://openalex.org/F4320324734,Yunnan Provincial Department of Education
https://openalex.org/F4320326843,State Key Laboratory of Organic–Inorganic Composites
https://openalex.org/F4320327010,State Key Laboratory of Supramolecular Structure and Materials
https://openalex.org/F4320325370,National Research Council of Science and Technology
https://openalex.org/F4320327794,Qinglan Project of Jiangsu Province of China
https://openalex.org/F4320326721,Qingdao National Laboratory for Marine Science and Technology
https://openalex.org/F4320321471,Hunan Provincial Science and Technology Department
https://openalex.org/F4320321572,Beijing Municipal Commission of Education
https://openalex.org/F4320325174,Beijing University of Civil Engineering and Architecture
https://openalex.org/F4320314013,SFPE Foundation
https://openalex.org/F4320317779,Zhejiang Provincial Postdoctoral Science Foundation
https://openalex.org/F4320322980,Fundação de Amparo à Pesquisa do Estado de Minas Gerais
https://openalex.org/F4320337198,Fakultas Teknik Universitas Indonesia
https://openalex.org/F4320308269,Alexander von Humboldt-Stiftung
https://openalex.org/F4320321332,Kyung Hee University
https://openalex.org/F4320327826,Jilin Province Key R&D Plan Project
https://openalex.org/F4320336347,State Key Laboratory of Building Safety and Built Environment
https://openalex.org/F4320321793,Beijing Municipal Education Commission
https://openalex.org/F4320334626,Medical Research Council
https://openalex.org/F4320326892,"National Laboratory of Solid State Microstructures, Nanjing University"
https://openalex.org/F4320337362,National Institute of Arthritis and Musculoskeletal and Skin Diseases
https://openalex.org/F4320321470,Beijing University of Posts and Telecommunications
https://openalex.org/F4320335000,Changjiang Scholar Program of Chinese Ministry of Education
https://openalex.org/F4320309309,Brigham Young University
https://openalex.org/F4320333591,Multidisciplinary University Research Initiative
https://openalex.org/F4320322816,Guangxi University for Nationalities
https://openalex.org/F4320321030,VINNOVA
https://openalex.org/F4320327279,Chongqing Municipal Human Resources and Social Security Bureau
https://openalex.org/F4320309990,Arcelor
https://openalex.org/F4320317775,Tianjin Postdoctoral Science Foundation
https://openalex.org/F4320321487,"Canadian Network for Research and Innovation in Machining Technology, Natural Sciences and Engineering Research Council of Canada"
https://openalex.org/F4320319065,Aromatic Plant Research Center
https://openalex.org/F4320337337,National Institute on Aging
https://openalex.org/F4320337338,"National Heart, Lung, and Blood Institute"
https://openalex.org/F4320337359,National Institute of Neurological Disorders and Stroke
https://openalex.org/F4320317324,Research Fund for Young Star of Science and Technology in Shaanxi Province
https://openalex.org/F4320335803,Shenzhen Fundamental Research and Discipline Layout project
https://openalex.org/F4320336033,Overseas Expertise Introduction Project for Discipline Innovation
https://openalex.org/F4320338362,FP7 International Cooperation
https://openalex.org/F4320322924,Changsha University of Science and Technology
https://openalex.org/F4320322030,"Ministry of Science, ICT and Future Planning"
https://openalex.org/F4320328720,Qilu University of Technology
https://openalex.org/F4320336742,Key Research and Development Program of Liaoning Province
https://openalex.org/F4320312331,Banco Santander
https://openalex.org/F4320335801,Science and Technology Innovative Research Team in Higher Educational Institutions of Hunan Province
https://openalex.org/F4320336753,Changsha Science and Technology Project
https://openalex.org/F4320336611,Naval Health Research Center
https://openalex.org/F4320329814,Kadoorie Charitable Foundation
https://openalex.org/F4320336808,National Natural Science Foundation of China-Nuclear Technology Innovation Joint Fund
https://openalex.org/F4320321026,Ministry of Earth Sciences
https://openalex.org/F4320336765,Indian Institute of Tropical Meteorology
https://openalex.org/F4320317330,Jiangsu Overseas Research and Training Program for University Prominent Young and Middle-aged Teachers and Presidents
https://openalex.org/F4320320933,Rijksuniversiteit Groningen
https://openalex.org/F4320328759,Shanghai Office of Philosophy and Social Science
https://openalex.org/F4320325431,Wuhan University of Science and Technology
https://openalex.org/F4320330032,Ng Teng Fong Charitable Foundation
https://openalex.org/F4320322605,Ningbo University
https://openalex.org/F4320327658,South China Agricultural University
https://openalex.org/F4320322720,Southwest Jiaotong University
https://openalex.org/F4320321759,Stiftelsen för Kunskaps- och Kompetensutveckling
https://openalex.org/F4320326674,Department of Education of Guizhou Province
https://openalex.org/F4320307858,Asian Development Bank
https://openalex.org/F4320313619,Chang Gung Memorial Hospital
https://openalex.org/F4320309870,Jiangsu Agricultural Science and Technology Innovation Fund
https://openalex.org/F4320315778,Strategic Innovation Fund
https://openalex.org/F4320322622,Toyota Motor Corporation
https://openalex.org/F4320335353,National Science Foundation of Sri Lanka
https://openalex.org/F4320332705,Brigham Research Institute
https://openalex.org/F4320337391,"Division of Civil, Mechanical and Manufacturing Innovation"
https://openalex.org/F4320316344,Key Project of Research and Development Plan of Hunan Province
https://openalex.org/F4320321390,Fonds De La Recherche Scientifique - FNRS
https://openalex.org/F4320324952,Université de Montpellier
https://openalex.org/F4320325512,Wuhan Polytechnic University
https://openalex.org/F4320314867,Fire Protection Research Foundation
https://openalex.org/F4320326174,Shaanxi Province Postdoctoral Science Foundation
https://openalex.org/F4320332392,Pipeline and Hazardous Materials Safety Administration
https://openalex.org/F4320326938,"State Key Laboratory of Information Engineering in Surveying, Mapping and Remote Sensing"
https://openalex.org/F4320336954,"State Key Laboratory of Advanced Displays and Optoelectronics Technologies, Hong Kong University of Science and Technology"
https://openalex.org/F4320334815,China Construction Eighth Engineering Division
https://openalex.org/F4320322438,Nanjing University of Aeronautics and Astronautics
https://openalex.org/F4320337014,Key Laboratory of Dynamic Cognitive System of Electromagnetic Spectrum Space
https://openalex.org/F4320335919,Major Projects of Guangdong Education Department for Foundation Research and Applied Research
https://openalex.org/F4320330390,Yunnan Provincial Department of Education Science Research Fund Project
https://openalex.org/F4320323250,Zhejiang Shuren University
https://openalex.org/F4320324873,South University of Science and Technology of China
https://openalex.org/F4320321002,Research Promotion Foundation
https://openalex.org/F4320336639,Yibin Science and Technology Planning Program
https://openalex.org/F4320338195,Australian Research Council Industrial Transformation Training Centre for Functional Grains
https://openalex.org/F4320309594,Utah Science Technology and Research
https://openalex.org/F4320313612,Chongqing Postdoctoral Science Foundation
https://openalex.org/F4320327772,Guangdong Provincial Applied Science and Technology Research and Development Program
https://openalex.org/F4320327776,Innovation Scientists and Technicians Troop Construction Projects of Henan Province
https://openalex.org/F4320333687,Manchester Biomedical Research Centre
https://openalex.org/F4320336220,"Asia Research Center, Nankai University"
https://openalex.org/F4320335595,National Natural Science Foundation of China-Yunnan Joint Fund
https://openalex.org/F4320336196,"University Research Facility in Chemical and Environmental Analysis, Hong Kong Polytechnic University"
https://openalex.org/F4320327672,Scientific Research Foundation of Shaanxi Provincial Key Laboratory
https://openalex.org/F4320330324,Yulin University
https://openalex.org/F4320309652,University of Michigan
https://openalex.org/F4320324983,Nanjing Tech University
https://openalex.org/F4320321525,Chang'an University
https://openalex.org/F4320327402,Shanghai International Studies University
https://openalex.org/F4320329863,Postdoctoral Innovation Project of Shandong Province
https://openalex.org/F4320332178,National Institute of Standards and Technology
https://openalex.org/F4320337506,Advanced Scientific Computing Research
https://openalex.org/F4320322191,Hunan University
https://openalex.org/F4320320945,Københavns Universitet
https://openalex.org/F4320322643,Ministry of Land and Resources of the People's Republic of China
https://openalex.org/F4320327224,Shaanxi Provincial Science and Technology Department
https://openalex.org/F4320324560,Department of Education of Liaoning Province
https://openalex.org/F4320327799,Scientific Research Fund of Liaoning Provincial Education Department
https://openalex.org/F4320316125,China Railway
https://openalex.org/F4320320834,Enterprise Ireland
https://openalex.org/F4320332538,University of Colorado Boulder
https://openalex.org/F4320324032,Xi’an Jiaotong-Liverpool University
https://openalex.org/F4320328359,"Ministry of Science and ICT, South Korea"
https://openalex.org/F4320311039,Ministry of Higher Education and Scientific Research
https://openalex.org/F4320328111,Chengdu University
https://openalex.org/F4320321603,Anhui Medical University
https://openalex.org/F4320326950,State Key Laboratory of Clean Energy Utilization
https://openalex.org/F4320323092,National Tsing Hua University
https://openalex.org/F4320329901,Shanghai Municipal People's Government
https://openalex.org/F4320322970,Education Department of Sichuan Province
https://openalex.org/F4320330383,Key Research Institute of Humanities and Social Sciences in Sichuan Province
https://openalex.org/F4320310926,Università degli Studi Roma Tre
https://openalex.org/F4320323154,China University of Mining and Technology
https://openalex.org/F4320327829,Primary Research and Development Plan of Zhejiang Province
https://openalex.org/F4320321586,Government of Guangdong Province
https://openalex.org/F4320336365,Seed Foundation of Tianjin University
https://openalex.org/F4320325570,Shanghai Municipal Human Resources and Social Security Bureau
https://openalex.org/F4320315633,Immunodiagnostic Systems Holdings
https://openalex.org/F4320328015,West Light Foundation of the Chinese Academy of Sciences
https://openalex.org/F4320314561,Tyre Stewardship Australia
https://openalex.org/F4320309369,Massachusetts Institute of Technology
https://openalex.org/F4320335792,Hubei Technological Innovation Special Fund
https://openalex.org/F4320329781,Hubei University
https://openalex.org/F4320321142,Hanyang University
https://openalex.org/F4320329794,Social Science Foundation of Shaanxi Province
https://openalex.org/F4320324977,Shaanxi University of Science and Technology
https://openalex.org/F4320325627,Education Department of Shaanxi Province
https://openalex.org/F4320309777,Lee Hysan Foundation
https://openalex.org/F4320327585,Fuyang Normal University
https://openalex.org/F4320312338,University of International Business and Economics
https://openalex.org/F4320324638,Wuhan University of Technology
https://openalex.org/F4320321655,Science and Technology Development Fund
https://openalex.org/F4320318708,Computational and Information Systems Laboratory
https://openalex.org/F4320321524,Chang Gung University
https://openalex.org/F4320319766,Nan Fung Life Sciences
https://openalex.org/F4320321798,Ministerstvo Zdravotnictví Ceské Republiky
https://openalex.org/F4320322298,Jiangsu Normal University
https://openalex.org/F4320322300,Jilin University
https://openalex.org/F4320326972,University of Chinese Academy of Sciences
https://openalex.org/F4320335958,Ministry of Education Key Projects of Philosophy and Social Sciences Research
https://openalex.org/F4320320885,European Research Consortium for Informatics and Mathematics
https://openalex.org/F4320322272,Guizhou Science and Technology Department
https://openalex.org/F4320325104,Wuhan National Laboratory for Optoelectronics
https://openalex.org/F4320308309,U.S. Social Security Administration
https://openalex.org/F4320319990,National Institute for Health and Care Research
https://openalex.org/F4320321681,"Ministry of Trade, Industry and Energy"
https://openalex.org/F4320321569,China Meteorological Administration
https://openalex.org/F4320317355,Beijing Institute of Fashion Technology
https://openalex.org/F4320331102,Shenzhen Research Institute of Big Data
https://openalex.org/F4320325408,Fuzhou University
https://openalex.org/F4320334514,Space Technology Mission Directorate
https://openalex.org/F4320322175,Hospital Authority
https://openalex.org/F4320325227,Jubiläumsstiftung der Schweizerischen Lebensversicherungs- und Rentenanstalt für Volksgesundheit und medizinische Forschung
https://openalex.org/F4320334015,Joint Fund of the National Natural Science Foundation of China and the Karst Science Research Center of Guizhou Province
https://openalex.org/F4320335628,Key Laboratory of Computer Network and Information Integration
https://openalex.org/F4320332162,Centers for Disease Control and Prevention
https://openalex.org/F4320330895,Salvation Army
https://openalex.org/F4320325716,Mansoura University
https://openalex.org/F4320326675,Xinjiang Uygur Autonomous Region Department of Education
https://openalex.org/F4320306080,Foundation for the National Institutes of Health
https://openalex.org/F4320326709,Tianjin Municipal Education Commission
https://openalex.org/F4320325338,Shanghai Hospital Development Center
https://openalex.org/F4320326217,Hunan Provincial Innovation Foundation for Postgraduate
https://openalex.org/F4320327501,Xuzhou Medical University
https://openalex.org/F4320331712,Canadian Society of Transplantation
https://openalex.org/F4320323421,Göteborgs Universitet
https://openalex.org/F4320327796,Science and Technology Planning Project of Fuzhou
https://openalex.org/F4320322161,Guangdong Medical Research Foundation
https://openalex.org/F4320321481,"Canada Excellence Research Chairs, Government of Canada"
https://openalex.org/F4320327600,Jiangsu Agricultural Science and Technology Independent Innovation Fund
https://openalex.org/F4320322347,Ministry of Science ICT and Future Planning
https://openalex.org/F4320336579,"Bureau of Frontier Sciences and Education, Chinese Academy of Sciences"
https://openalex.org/F4320338154,Science and Technology Service Network Plan
https://openalex.org/F4320324851,Hebei University
https://openalex.org/F4320318062,Policy Innovation and Co-ordination Office
https://openalex.org/F4320308959,American Accounting Association
https://openalex.org/F4320321760,Henan University of Science and Technology
https://openalex.org/F4320327610,Collaborative Innovation Center of Suzhou Nano Science and Technology
https://openalex.org/F4320316083,Tencent
https://openalex.org/F4320308982,American Society of Clinical Oncology
https://openalex.org/F4320319188,Hamad Bin Khalifa University
https://openalex.org/F4320332748,"College of Science and Engineering, University of Minnesota"
https://openalex.org/F4320332753,Qatar National Research Fund
https://openalex.org/F4320334468,Qatar National Library
https://openalex.org/F4320337351,National Cancer Institute
https://openalex.org/F4320337345,Office of Naval Research
https://openalex.org/F4320336607,Natural Science Foundation of Guangdong Province for Distinguished Young Scholars
https://openalex.org/F4320326290,National Planning Office of Philosophy and Social Science
https://openalex.org/F4320320939,Swedish Foundation for International Cooperation in Research and Higher Education
https://openalex.org/F4320337538,U.S. Army Corps of Engineers
https://openalex.org/F4320327296,Ministry of Education – Kingdom of Saudi Arabi
https://openalex.org/F4320316908,Chongqing Municipal Health Commission
https://openalex.org/F4320322482,Akademie Věd České Republiky
https://openalex.org/F4320321114,Bundesministerium für Bildung und Forschung
https://openalex.org/F4320316884,Natural Science Foundation of Xiamen City
https://openalex.org/F4320329793,Shenzhen Knowledge Innovation Program
https://openalex.org/F4320334797,"Centro universitario di ricerca e formazione per lo sviluppo competitivo delle imprese del settore vitivinicolo italiano, Università degli Studi di Firenze"
https://openalex.org/F4320326041,Construction Industry Council
https://openalex.org/F4320322035,Rural Development Administration
https://openalex.org/F4320338289,Brookhaven National Laboratory
https://openalex.org/F4320320859,Ulster University
https://openalex.org/F4320336628,Special Fund Project of Guiding Scientific and Technological Innovation Development of Gansu Province
https://openalex.org/F4320313614,Heilongjiang Postdoctoral Science Foundation
https://openalex.org/F4320327313,"Science and Technology Department, Heilongjiang Province"
https://openalex.org/F4320334995,CAST Innovation Foundation
https://openalex.org/F4320309815,Qatar Foundation
https://openalex.org/F4320310620,University of Texas at Austin
https://openalex.org/F4320330367,Nanjing Medical Science and Technique Development Foundation
https://openalex.org/F4320325413,Shanghai Municipal Commission of Economy and Informatization
https://openalex.org/F4320321800,Nederlandse Organisatie voor Wetenschappelijk Onderzoek
https://openalex.org/F4320321873,"Ministero dell’Istruzione, dell’Università e della Ricerca"
https://openalex.org/F4320338253,Beijing National Laboratory for Molecular Sciences
https://openalex.org/F4320324303,Beijing University of Chemical Technology
https://openalex.org/F4320322211,Indian Institute of Technology Madras
https://openalex.org/F4320334771,Science and Engineering Research Board
https://openalex.org/F4320333292,"Faculty of Science and Engineering, University of Manchester"
https://openalex.org/F4320336644,High-end Foreign Experts Recruitment Plan of China
https://openalex.org/F4320322243,Iran National Science Foundation
https://openalex.org/F4320335377,Pearl River S and T Nova Program of Guangzhou
https://openalex.org/F4320327522,Guangxi University
https://openalex.org/F4320328841,State Key Laboratory of Bio-Fibers and Eco-Textiles
https://openalex.org/F4320311436,Salt Science Research Foundation
https://openalex.org/F4320328135,I.M. Sechenov First Moscow State Medical University
https://openalex.org/F4320329807,Ministry of Health of the Russian Federation
https://openalex.org/F4320327076,Bureau of Science and Technology of Zhoushan
https://openalex.org/F4320334117,National Natural Science Foundation of China-Shenzhen Robotics Research Center Project
https://openalex.org/F4320334545,Office of Fossil Energy and Carbon Management
https://openalex.org/F4320310657,Sumitomo Foundation
