oa_funder_id,oa_funder_name
https://openalex.org/F4320321001,National Natural Science Foundation of China
https://openalex.org/F4320321543,China Postdoctoral Science Foundation
https://openalex.org/F4320335787,Fundamental Research Funds for the Central Universities
https://openalex.org/F4320322120,National Research Foundation of Korea
https://openalex.org/F4320335777,National Key Research and Development Program of China
https://openalex.org/F4320333642,Scientific Research Foundation of Hunan Provincial Education Department
https://openalex.org/F4320322999,Shanghai Jiao Tong University
https://openalex.org/F4320316880,Natural Science Foundation of Shenzhen City
https://openalex.org/F4320320508,"Apple University Development Fund, Apple University Consortium"
https://openalex.org/F4320336569,Shenzhen Science and Technology Innovation Program
https://openalex.org/F4320326705,"Science, Technology and Innovation Commission of Shenzhen Municipality"
https://openalex.org/F4320322598,Hong Kong Polytechnic University
https://openalex.org/F4320337111,Basic and Applied Basic Research Foundation of Guangdong Province
https://openalex.org/F4320322843,Natural Science Foundation of Hunan Province
https://openalex.org/F4320321019,University Grants Committee
https://openalex.org/F4320329815,Hong Kong Government
https://openalex.org/F4320322919,Natural Science Foundation of Beijing Municipality
https://openalex.org/F4320321940,Harbin Institute of Technology
https://openalex.org/F4320321133,Chinese Academy of Sciences
https://openalex.org/F4320329699,Zhongshan Science and Technology Bureau
https://openalex.org/F4320329791,Shenzhen Fundamental Research Program
https://openalex.org/F4320320969,University of Wollongong
https://openalex.org/F4320334010,Key Research and Development Program of Ningxia
https://openalex.org/F4320335564,Chinese Government Scholarship
https://openalex.org/F4320321592,"Research Grants Council, University Grants Committee"
https://openalex.org/F4320327274,Hong Kong Arts Development Council
https://openalex.org/F4320336026,National Key Research and Development Program of China Stem Cell and Translational Research
https://openalex.org/F4320335563,"State Administration for Science, Technology and Industry for National Defense"
https://openalex.org/F4320329860,National Science and Technology Major Project
https://openalex.org/F4320336565,Key Science and Technology Program of Shaanxi Province
https://openalex.org/F4320335912,Foundation for Innovation Groups of Basic Research in Gansu Province
https://openalex.org/F4320335869,National Social Science Fund of China
https://openalex.org/F4320329861,Natural Science Foundation of Sichuan Province
https://openalex.org/F4320320291,University of Manchester
https://openalex.org/F4320336573,"Humanities and Social Sciences Youth Foundation, Ministry of Education of the People's Republic of China"
https://openalex.org/F4320323085,Natural Science Foundation of Heilongjiang Province
https://openalex.org/F4320336125,National Science Fund for Distinguished Young Scholars
https://openalex.org/F4320322847,Youth Innovation Promotion Association of the Chinese Academy of Sciences
https://openalex.org/F4320335765,National Key Scientific Instrument and Equipment Development Projects of China
https://openalex.org/F4320331245,Guangdong Provincial Key Laboratory Of Catalysis
https://openalex.org/F4320321709,"Ministry of Higher Education, Malaysia"
https://openalex.org/F4320322604,Universiti Malaya
https://openalex.org/F4320338464,Natural Science Foundation of Zhejiang Province
https://openalex.org/F4320322769,Natural Science Foundation of Jiangsu Province
https://openalex.org/F4320335440,Natural Science Research of Jiangsu Higher Education Institutions of China
https://openalex.org/F4320324196,Innovation and Technology Commission - Hong Kong
https://openalex.org/F4320326427,Innovation and Technology Fund
https://openalex.org/F4320334897,Natural Science Foundation of Anhui Province
https://openalex.org/F4320309893,City University of Hong Kong
https://openalex.org/F4320322186,Natural Science Foundation of Hubei Province
https://openalex.org/F4320322925,Ministry of Transport of the People's Republic of China
https://openalex.org/F4320320696,"Agency for Science, Technology and Research"
https://openalex.org/F4320320709,National Research Foundation Singapore
https://openalex.org/F4320322439,Northwest University
https://openalex.org/F4320334925,Science and Technology Support Program of Jiangsu Province
https://openalex.org/F4320335802,Shaanxi Key Science and Technology Innovation Team Project
https://openalex.org/F4320336350,Key Research and Development Projects of Shaanxi Province
https://openalex.org/F4320336567,Natural Science Basic Research Program of Shaanxi Province
https://openalex.org/F4320328099,Hefei University of Technology
https://openalex.org/F4320321921,Natural Science Foundation of Guangdong Province
https://openalex.org/F4320327912,Higher Education Discipline Innovation Project
https://openalex.org/F4320330206,Science and Technology Program of Hunan Province
https://openalex.org/F4320328043,Patient Safety Translational Research Centre
https://openalex.org/F4320320879,Deutsche Forschungsgemeinschaft
https://openalex.org/F4320315254,Innovative Research Group Project of the National Natural Science Foundation of China
https://openalex.org/F4320322841,Universidade de Macau
https://openalex.org/F4320322857,Aeronautical Science Foundation of China
https://openalex.org/F4320324202,Guangdong Science and Technology Department
https://openalex.org/F4320322163,Natural Science Foundation of Hebei Province
https://openalex.org/F4320322392,Tsinghua University
https://openalex.org/F4320314362,European Cultural Foundation
https://openalex.org/F4320324392,Environment and Conservation Fund
https://openalex.org/F4320335095,"Department of Industrial and Systems Engineering, Hong Kong Polytechnic University"
https://openalex.org/F4320335872,Chongqing Graduate Student Research Innovation Project
https://openalex.org/F4320327478,Beijing Forestry University
https://openalex.org/F4320334704,Australian Research Council
https://openalex.org/F4320324174,Natural Science Foundation of Shandong Province
https://openalex.org/F4320313899,College of Optometrists
https://openalex.org/F4320307719,Society of the Friendly Sons of St. Patrick for the Relief of Emigrants from Ireland
https://openalex.org/F4320334978,Beijing Nova Program
https://openalex.org/F4320309612,Natural Science Foundation of Shanghai
https://openalex.org/F4320322942,Chinese University of Hong Kong
https://openalex.org/F4320315609,International Polyurethane Technology Foundation
https://openalex.org/F4320321920,Innovation and Technology Commission
https://openalex.org/F4320326907,State Key Laboratory of Robotics
https://openalex.org/F4320327034,State Key Laboratory of Tribology
https://openalex.org/F4320333115,"Health Innovation, Investment and Research Office"
https://openalex.org/F4320335076,"Hong Kong Institute of Educational Research, Chinese University of Hong Kong"
https://openalex.org/F4320326185,Taishan Scholar Foundation of Shandong Province
https://openalex.org/F4320321927,Guizhou University
https://openalex.org/F4320326181,National Aerospace Science Foundation of China
https://openalex.org/F4320327792,Program for Jiangsu Excellent Scientific and Technological Innovation Team
https://openalex.org/F4320328530,Foundation for Scientific and Technological Development in Health
https://openalex.org/F4320334627,Engineering and Physical Sciences Research Council
https://openalex.org/F4320306101,National Aeronautics and Space Administration
https://openalex.org/F4320333674,Earth Sciences Division
https://openalex.org/F4320332587,Natural Science Foundation of Ningbo
https://openalex.org/F4320326173,Excellent Youth Foundation of Heilongjiang Province of China
https://openalex.org/F4320335055,Health and Medical Research Fund
https://openalex.org/F4320332161,National Institutes of Health
https://openalex.org/F4320321540,Ministry of Science and Technology of the People's Republic of China
https://openalex.org/F4320320965,University of New South Wales
https://openalex.org/F4320335774,Key Technologies Research and Development Program
https://openalex.org/F4320309978,Florida Department of Transportation
https://openalex.org/F4320322511,Narodowe Centrum Nauki
https://openalex.org/F4320321145,King Saud University
https://openalex.org/F4320336600,Major Project of Philosophy and Social Science Research in Colleges and Universities of Jiangsu Province
https://openalex.org/F4320337213,"Department of Building and Real Estate, Hong Kong Polytechnic University"
https://openalex.org/F4320323993,Natural Science Foundation of Tianjin City
https://openalex.org/F4320338146,Natural Science Foundation of Tianjin-Science and Technology Correspondent Project
https://openalex.org/F4320322795,"Ministry of Science and Technology, Taiwan"
https://openalex.org/F4320323706,"Ministry of Science and Technology, Israel"
https://openalex.org/F4320322792,Nanchang University
https://openalex.org/F4320327557,National Office for Philosophy and Social Sciences
https://openalex.org/F4320324173,Natural Science Foundation of Shaanxi Province
https://openalex.org/F4320336648,National Program for Support of Top-notch Young Professionals
https://openalex.org/F4320327803,Shanghai Rising-Star Program
https://openalex.org/F4320335581,Young Scientists Fund
https://openalex.org/F4320321885,Science and Technology Commission of Shanghai Municipality
https://openalex.org/F4320333688,National Outstanding Youth Science Fund Project of National Natural Science Foundation of China
https://openalex.org/F4320320924,Schweizerischer Nationalfonds zur Förderung der Wissenschaftlichen Forschung
https://openalex.org/F4320326510,Urban Management Bureau of Shenzhen Municipality
https://openalex.org/F4320320904,Croucher Foundation
https://openalex.org/F4320324787,Peking University
https://openalex.org/F4320334977,Beijing Municipal Natural Science Foundation
https://openalex.org/F4320324252,Université Paris-Saclay
https://openalex.org/F4320336744,Science and Technology Program of Hubei Province
https://openalex.org/F4320326796,Hong Kong Research Institute of Textiles and Apparel
https://openalex.org/F4320316081,Jilin Province Development and Reform Commission
https://openalex.org/F4320333335,Sichuan Province Science and Technology Support Program
https://openalex.org/F4320311649,Ministry of Education
https://openalex.org/F4320335882,General Research Fund of Shanghai Normal University
https://openalex.org/F4320335880,Fundamental Research Funds for Central Universities of the Central South University
https://openalex.org/F4320328119,National University's Basic Research Foundation of China
https://openalex.org/F4320338510,Materials and Manufacturing Directorate
https://openalex.org/F4320335795,Science and Technology Planning Project of Guangdong Province
https://openalex.org/F4320329899,Scientific Research Foundation of Education Department of Anhui Province of China
https://openalex.org/F4320335443,Postdoctoral Research Foundation of China
https://openalex.org/F4320335768,National Postdoctoral Program for Innovative Talents
https://openalex.org/F4320321545,China Sponsorship Council
https://openalex.org/F4320306076,National Science Foundation
https://openalex.org/F4320329895,Liaoning Revitalization Talents Program
https://openalex.org/F4320334014,Youth Innovation Technology Project of Higher School in Shandong Province
https://openalex.org/F4320335994,Program for Nonferrous Metals Vacuum Metallurgy Innovation Team of Ministry of Science and Technology
https://openalex.org/F4320332236,"Annenberg School for Communication and Journalism, University of Southern California"
https://openalex.org/F4320323246,Damghan University
https://openalex.org/F4320321878,Natural Science Foundation of Fujian Province
https://openalex.org/F4320323172,Natural Science Foundation of Chongqing
https://openalex.org/F4320335848,Agricultural Science and Technology Innovation Program
https://openalex.org/F4320328746,Guilin Medical University
https://openalex.org/F4320322725,China Scholarship Council
https://openalex.org/F4320320974,University of Melbourne
https://openalex.org/F4320334737,National Medical Research Council
https://openalex.org/F4320325030,Guangdong University of Technology
https://openalex.org/F4320326228,Southern Medical University
https://openalex.org/F4320326707,State Grid Corporation of China
https://openalex.org/F4320337135,"Faculty of Science, Chinese University of Hong Kong"
https://openalex.org/F4320324116,Wuhan University
https://openalex.org/F4320335982,Humanities and Social Science Fund of Ministry of Education of China
https://openalex.org/F4320334593,Natural Sciences and Engineering Research Council of Canada
https://openalex.org/F4320321925,Guilin University of Technology
https://openalex.org/F4320323537,Hong Kong University of Science and Technology
https://openalex.org/F4320334845,"Agentúra Ministerstva Školstva, Vedy, Výskumu a Športu SR"
https://openalex.org/F4320322866,Natural Science Foundation of Hainan Province
https://openalex.org/F4320338204,Program for Changjiang Scholars and Innovative Research Team in University
https://openalex.org/F4320314149,State Key Laboratory in Marine Pollution
https://openalex.org/F4320317337,Science and Technology Foundation of Shenzhen City
https://openalex.org/F4320321730,Fonds Wetenschappelijk Onderzoek
https://openalex.org/F4320321912,Ministry of Education and Science of the Russian Federation
https://openalex.org/F4320325437,Jiangsu Science and Technology Department
https://openalex.org/F4320326186,China National Textile and Apparel Council
https://openalex.org/F4320311778,China Association for Science and Technology
https://openalex.org/F4320336602,Major Science and Technology Projects in Yunnan Province
https://openalex.org/F4320320338,Human Frontier Science Program
https://openalex.org/F4320321363,Incheon National University
https://openalex.org/F4320320005,Royal Academy of Engineering
https://openalex.org/F4320334997,Chinese Universities Scientific Fund
https://openalex.org/F4320326672,China Petrochemical Corporation
https://openalex.org/F4320320337,University of Glasgow
https://openalex.org/F4320335376,Medical Science and Technology Foundation of Guangdong Province
https://openalex.org/F4320336405,Special Project for Research and Development in Key areas of Guangdong Province
https://openalex.org/F4320331610,Institut Canadien des Dérivés
https://openalex.org/F4320329690,National Institute of Clean-and-Low-Carbon Energy
https://openalex.org/F4320321514,Central South University
https://openalex.org/F4320306709,Glaucoma Research Foundation
https://openalex.org/F4320327913,ShanXi Science and Technology Department
https://openalex.org/F4320336589,Guangxi Key Research and Development Program
https://openalex.org/F4320310490,Villum Fonden
https://openalex.org/F4320327387,Danmarks Frie Forskningsfond
https://openalex.org/F4320327181,"Research Institute for Sustainable Urban Development, Hong Kong Polytechnic University"
https://openalex.org/F4320326414,Education University of Hong Kong
https://openalex.org/F4320327891,Major Basic Research Project of the Natural Science Foundation of the Jiangsu Higher Education Institutions
https://openalex.org/F4320321346,University of Seoul
https://openalex.org/F4320324625,Korea Agency for Infrastructure Technology Advancement
https://openalex.org/F4320328618,Lingnan University
https://openalex.org/F4320329479,Universitas Negeri Jakarta
https://openalex.org/F4320322990,Sichuan University
https://openalex.org/F4320309549,University of Houston
https://openalex.org/F4320335767,Sanming Project of Medicine in Shenzhen
https://openalex.org/F4320309776,Lee Foundation
https://openalex.org/F4320325599,University of Science and Technology of China
https://openalex.org/F4320315075,Western Sydney Local Health District
https://openalex.org/F4320334705,National Health and Medical Research Council
https://openalex.org/F4320322684,Hubei University of Automotive Technology
https://openalex.org/F4320322499,Renmin University of China
https://openalex.org/F4320327677,State Key Laboratory Of Alternate Electrical Power System With Renewable Energy Sources
https://openalex.org/F4320326278,Philosophy and Social Science Foundation of Hunan Province
https://openalex.org/F4320329755,Jiangsu Association for Science and Technology
https://openalex.org/F4320326177,Chinesisch-Deutsche Zentrum für Wissenschaftsförderung
https://openalex.org/F4320327397,Gannan Normal University
https://openalex.org/F4320315595,J. Willard and Alice S. Marriott Foundation
https://openalex.org/F4320313979,Polytechnique Montréal
https://openalex.org/F4320316338,Special Project for Marine Economy Development of Guangdong Province
https://openalex.org/F4320334953,China National Funds for Distinguished Young Scientists
https://openalex.org/F4320326664,Anhui Provincial Department of Education
https://openalex.org/F4320313796,Innovationsfonden
https://openalex.org/F4320325438,Wuhan Institute of Technology
https://openalex.org/F4320317581,Health Commission of Hunan Province
https://openalex.org/F4320334779,Fundação para a Ciência e a Tecnologia
https://openalex.org/F4320321547,"China University of Petroleum, Beijing"
https://openalex.org/F4320338335,H2020 European Research Council
https://openalex.org/F4320310264,University of Nebraska-Lincoln
https://openalex.org/F4320330122,Southwest Minzu University
https://openalex.org/F4320335817,National Social Science Fund Youth Project
https://openalex.org/F4320310901,Guangdong University of Petrochemical Technology
https://openalex.org/F4320326279,Department of Education of Guangdong Province
https://openalex.org/F4320322997,King Abdulaziz City for Science and Technology
https://openalex.org/F4320334009,Guangdong Provincial Pearl River Talents Program
https://openalex.org/F4320322036,Korea Meteorological Administration
https://openalex.org/F4320334877,Korea Environmental Industry and Technology Institute
https://openalex.org/F4320320751,Ministry of Education - Singapore
https://openalex.org/F4320328656,Singapore Management University
https://openalex.org/F4320337986,Tsinghua Shenzhen International Graduate School
https://openalex.org/F4320321432,Beijing Normal University
https://openalex.org/F4320330214,Key Research and Development Program of Hunan Province of China
https://openalex.org/F4320327695,Nazarbayev University
https://openalex.org/F4320325571,Shenzhen University
https://openalex.org/F4320327518,Priority Academic Program Development of Jiangsu Higher Education Institutions
https://openalex.org/F4320323893,Fundo para o Desenvolvimento das Ciências e da Tecnologia
https://openalex.org/F4320335575,Key Programme
https://openalex.org/F4320336672,"Institute of Geology and Geophysics, Chinese Academy of Sciences"
https://openalex.org/F4320321408,Ministry of Education
https://openalex.org/F4320327785,Major Program of National Fund of Philosophy and Social Science of China
https://openalex.org/F4320321848,Cambridge Trust
https://openalex.org/F4320329813,Henry Lester Trust
https://openalex.org/F4320318614,Anhui Office of Philosophy and Social Science
https://openalex.org/F4320336580,Chengdu Office of Philosophy and Social Science
https://openalex.org/F4320337228,"Faculty of Liberal Arts and Social Sciences, Education University of Hong Kong"
https://openalex.org/F4320313895,Department of Science and Technology of Shandong Province
https://openalex.org/F4320333596,Key Technology Research and Development Program of Shandong
https://openalex.org/F4320323441,"Chang Gung Memorial Hospital, Linkou"
https://openalex.org/F4320323845,Natural Science Foundation of Henan Province
https://openalex.org/F4320318558,Peng Cheng Laboratory
https://openalex.org/F4320326980,State Key Laboratory of Explosion Science and Technology
https://openalex.org/F4320326964,Qingdao University
https://openalex.org/F4320321570,China National Petroleum Corporation
https://openalex.org/F4320327777,Jiangsu Provincial Key Research and Development Program
https://openalex.org/F4320320955,Hong Kong Baptist University
https://openalex.org/F4320328117,Minzu University of China
https://openalex.org/F4320331156,King Faisal University
https://openalex.org/F4320326997,State Key Laboratory of Coastal and Offshore Engineering
https://openalex.org/F4320322975,Danish e-Infrastructure Cooperation
https://openalex.org/F4320338453,HORIZON EUROPE European Research Council
https://openalex.org/F4320330561,Key Laboratory of Modern Manufacturing Technology of the Ministry of Education
https://openalex.org/F4320327665,Key Laboratory for Magnetic Resonance and Multimodality Imaging of Guangdong Province
https://openalex.org/F4320329504,First Affiliated Hospital of Zhengzhou University
https://openalex.org/F4320329752,Health and Family Planning Commission of Lianyungang City
https://openalex.org/F4320335961,National Science and Technology Planning Project
https://openalex.org/F4320335480,Guangzhou Municipal Science and Technology Project
https://openalex.org/F4320320766,Nanyang Technological University
https://openalex.org/F4320322665,Natural Science Foundation of Jiangxi Province
https://openalex.org/F4320322170,University of Hong Kong
https://openalex.org/F4320322292,Jinan University
https://openalex.org/F4320327726,"Natural Science Foundation Project of Chongqing, Chongqing Science and Technology Commission"
https://openalex.org/F4320327511,Development and Reform Commission of Shenzhen Municipality
https://openalex.org/F4320312452,Columbus State University
https://openalex.org/F4320323190,Fujian Provincial Department of Science and Technology
https://openalex.org/F4320331100,Fujian Provincial Federation of Social Sciences
https://openalex.org/F4320334764,Japan Society for the Promotion of Science
https://openalex.org/F4320323066,Beijing Jiaotong University
https://openalex.org/F4320328098,Harbin Normal University
https://openalex.org/F4320322493,Ministry of Railways
https://openalex.org/F4320335574,Joint Research Fund for Overseas Chinese Scholars and Scholars in Hong Kong and Macao
https://openalex.org/F4320331088,Natural Science Foundation for Young Scientists of Shanxi Province
https://openalex.org/F4320321106,Ministry of Education of the People's Republic of China
https://openalex.org/F4320308297,Craig H. Neilsen Foundation
https://openalex.org/F4320337611,Eunice Kennedy Shriver National Institute of Child Health and Human Development
https://openalex.org/F4320322174,People's Government of Jilin Province
https://openalex.org/F4320326270,Education Department of Jilin Province
https://openalex.org/F4320328566,Dongguan University of Technology
https://openalex.org/F4320322858,State Government of Victoria
https://openalex.org/F4320328958,Department of Science and Technology of Inner Mongolia
https://openalex.org/F4320327519,Jiangxi University of Traditional Chinese Medicine
https://openalex.org/F4320336746,Key Science and Technology Research Project in Jiangxi Province Department of Education
https://openalex.org/F4320335683,"Key Laboratory of Coal Resources Exploration and Comprehensive Utilization, Ministry of Land and Resources"
https://openalex.org/F4320324302,Kunming University of Science and Technology
https://openalex.org/F4320311904,Wellcome Trust
https://openalex.org/F4320328750,Wannan Medical College
https://openalex.org/F4320322651,Consiglio Nazionale delle Ricerche
https://openalex.org/F4320309618,Ministry of Science and Technology
https://openalex.org/F4320322397,Instituto Politécnico de Macau
https://openalex.org/F4320329539,Xuzhou Science and Technology Bureau
https://openalex.org/F4320328756,Program for the Scientific Activities of Selected Returned Overseas Professionals in Shaanxi Province
https://openalex.org/F4320331075,Science and Technology Innovation Group of Shanxi Province
https://openalex.org/F4320336035,Shanxi Provincial Key Research and Development Project
https://openalex.org/F4320324699,Ministerial Standing Committee on Scientific and Technological Cooperation of the Organization of Islamic Cooperation
https://openalex.org/F4320329337,Hui Hoy and Chow Sin Lan Charity Fund
https://openalex.org/F4320324679,Shenyang Science and Technology Bureau
https://openalex.org/F4320326183,Doctoral Start-up Foundation of Liaoning Province
https://openalex.org/F4320329351,Liaoning Shihua University
https://openalex.org/F4320310972,Shantou University
https://openalex.org/F4320310906,National Research Council Sri Lanka
https://openalex.org/F4320313096,Diamond Light Source
https://openalex.org/F4320336624,Social Science Planning Project of Shandong Province
https://openalex.org/F4320325397,"Centre of Excellence for Electromaterials Science, Australian Research Council"
https://openalex.org/F4320338245,Support Program for Starting up Innovation Hub
https://openalex.org/F4320336082,"Institute of Construction and Environmental Engineering, Seoul National University"
https://openalex.org/F4320336769,"Institute of Engineering Research, Seoul National University"
https://openalex.org/F4320335796,Program of Shanghai Academic Research Leader
https://openalex.org/F4320326909,State Key Laboratory of Hydraulics and Mountain River Engineering
https://openalex.org/F4320323370,Hainan University
https://openalex.org/F4320324882,Hainan Provincial Department of Science and Technology
https://openalex.org/F4320326503,"General Administration of Quality Supervision, Inspection and Quarantine of the People's Republic of China"
