oa_funder_id,oa_funder_name
https://openalex.org/F4320313610,Shanghai Science and Technology Development Foundation
https://openalex.org/F4320332462,"Horace H. Rackham School of Graduate Studies, University of Michigan"
https://openalex.org/F4320337366,Division of Social and Economic Sciences
https://openalex.org/F4320336348,Affiliated Hospital of Southwest Medical University
https://openalex.org/F4320330924,People's Public Security University of China
https://openalex.org/F4320327027,State Key Laboratory of Subtropical Building Science
https://openalex.org/F4320333334,Guangdong Province Introduction of Innovative R&D Team
https://openalex.org/F4320321160,Sun Yat-sen University
https://openalex.org/F4320326696,Jiangxi Provincial Department of Science and Technology
https://openalex.org/F4320330743,Guangzhou Municipal Science and Technology Bureau
https://openalex.org/F4320313613,Natural Science Foundation of Guangxi Zhuang Autonomous Region
https://openalex.org/F4320323192,China Southern Power Grid
https://openalex.org/F4320320006,Royal Society
https://openalex.org/F4320315885,Australian Government
https://openalex.org/F4320322685,Chongqing Technology and Business University
https://openalex.org/F4320323291,Food and Health Bureau
https://openalex.org/F4320326679,Guangdong Office of Philosophy and Social Science
https://openalex.org/F4320325835,Université de Recherche Paris Sciences et Lettres
https://openalex.org/F4320337336,Advanced Remanufacturing and Technology Centre
https://openalex.org/F4320329853,International Science and Technology Cooperation Program of Jiangsu Province
https://openalex.org/F4320309105,Cleveland State University
https://openalex.org/F4320331518,Centro Svizzero di Calcolo Scientifico
https://openalex.org/F4320334678,European Research Council
https://openalex.org/F4320306219,Alzheimer's Association
https://openalex.org/F4320320300,European Commission
https://openalex.org/F4320321705,Eusko Jaurlaritza
https://openalex.org/F4320322930,Ministerio de Ciencia e Innovación
https://openalex.org/F4320331146,Agencia Nacional de Investigación y Desarrollo
https://openalex.org/F4320334832,Agencia Nacional de Promoción Científica y Tecnológica
https://openalex.org/F4320335598,Agencia Estatal de Investigación
https://openalex.org/F4320326849,State Key Laboratory of Oil and Gas Reservoir Geology and Exploitation
https://openalex.org/F4320326848,State Key Laboratory of Geohazard Prevention and Geoenvironment Protection
https://openalex.org/F4320324887,Shandong Academy of Sciences
https://openalex.org/F4320336213,National Natural Science Foundation of China-Guangdong Joint Fund
https://openalex.org/F4320336651,Quanzhou City Science and Technology Program
https://openalex.org/F4320325434,Xiamen University
https://openalex.org/F4320335955,Key Scientific Research Project of Colleges and Universities in Henan Province
https://openalex.org/F4320313681,Taishan Scholar Foundation of Shandong Province
https://openalex.org/F4320336008,National College Students Innovation and Entrepreneurship Training Program
https://openalex.org/F4320326497,China Academy of Space Technology
https://openalex.org/F4320334262,"Tata Center for Technology and Design, Massachusetts Institute of Technology"
https://openalex.org/F4320325931,Beijing Social Science Fund
https://openalex.org/F4320320972,RMIT University
https://openalex.org/F4320324805,Chongqing Municipal Education Commission
https://openalex.org/F4320326784,CAS-Croucher Funding Scheme for Joint Laboratories
https://openalex.org/F4320320985,University of Southern Queensland
https://openalex.org/F4320321108,Academy of Finland
https://openalex.org/F4320320285,King's College London
https://openalex.org/F4320323292,University of Electronic Science and Technology of China
https://openalex.org/F4320335476,Sichuan Province Youth Science and Technology Innovation Team
https://openalex.org/F4320335357,Guangdong Academy of Sciences
https://openalex.org/F4320326713,Wuhan Municipal Science and Technology Bureau
https://openalex.org/F4320321883,Huazhong University of Science and Technology
https://openalex.org/F4320336592,Hebei Province Outstanding Youth Fund
https://openalex.org/F4320327024,State Key Laboratory of Mechanical System and Vibration
https://openalex.org/F4320310638,McGill University
https://openalex.org/F4320318616,Henan Office of Philosophy and Social Science
https://openalex.org/F4320328768,Ningbo University of Technology
https://openalex.org/F4320330381,Shenzhen-Hong Kong Institute of Brain Science
https://openalex.org/F4320325902,Beijing Municipal Science and Technology Commission
https://openalex.org/F4320324847,Zhejiang Sci-Tech University
https://openalex.org/F4320327025,State Key Laboratory of Advanced Optical Communication Systems and Networks
https://openalex.org/F4320335790,Shenzhen Peacock Plan
https://openalex.org/F4320336756,Tianjin Science and Technology Program
https://openalex.org/F4320330043,Western Sydney University
https://openalex.org/F4320334890,"University Research Committee, University of Hong Kong"
https://openalex.org/F4320319965,Michael Smith Health Research BC
https://openalex.org/F4320334506,Canadian Institutes of Health Research
https://openalex.org/F4320338116,Research Institute of Science and Technology for Society
https://openalex.org/F4320321392,Northwestern Polytechnical University
https://openalex.org/F4320310121,Natural Science Foundation of Jilin Province
https://openalex.org/F4320336829,"Department of Mechanical Engineering, University of Alberta"
https://openalex.org/F4320320671,National Research Foundation
https://openalex.org/F4320317144,Beijing Logistics Informatics Research Base
https://openalex.org/F4320322887,The Research Council
https://openalex.org/F4320317524,"Henan Provincial Key Laboratory of Medical Polymer Materials Technology and Application, Tuoren Medical Device Co., Ltd."
https://openalex.org/F4320335983,National Natural Science Foundation of China-Shandong Joint Fund for Marine Science Research Centers
https://openalex.org/F4320335830,International Science and Technology Cooperation Programme
https://openalex.org/F4320322648,Università degli Studi di Firenze
https://openalex.org/F4320331164,National Science and Technology Council
https://openalex.org/F4320336618,Science and Technology Program of Suzhou
https://openalex.org/F4320336619,Science and Technology Project of Nantong City
https://openalex.org/F4320321505,Generalitat de Catalunya
https://openalex.org/F4320337712,Solar Energy Technologies Office
https://openalex.org/F4320337015,K. C. Wong Magna Fund in Ningbo University
https://openalex.org/F4320335577,Major Research Plan
https://openalex.org/F4320335785,Project 211
https://openalex.org/F4320321758,South China Normal University
https://openalex.org/F4320334898,Guangzhou Science and Technology Program key projects
https://openalex.org/F4320330311,Tin Ka Ping Foundation
https://openalex.org/F4320337369,Office of Polar Programs
https://openalex.org/F4320337402,Division of Atmospheric and Geospace Sciences
https://openalex.org/F4320306127,U.S. Department of Veterans Affairs
https://openalex.org/F4320337350,National Eye Institute
https://openalex.org/F4320323540,Society of Hong Kong Scholars
https://openalex.org/F4320326178,Heilongjiang Provincial Postdoctoral Science Foundation
https://openalex.org/F4320336652,Science and Technology Innovation Plan Of Shanghai Science and Technology Commission
https://openalex.org/F4320320967,University of Technology Sydney
https://openalex.org/F4320326982,State Key Laboratory of Information Photonics and Optical Communications
https://openalex.org/F4320328899,China University of Geosciences
https://openalex.org/F4320334909,Senior Talent Foundation of Jiangsu University
https://openalex.org/F4320322015,University of Toronto
https://openalex.org/F4320334617,Social Sciences and Humanities Research Council of Canada
https://openalex.org/F4320322320,King Abdullah University of Science and Technology
https://openalex.org/F4320334982,Basic Research Program of Jiangsu Province
https://openalex.org/F4320335629,"Suzhou Institute of Nanotechnology, Chinese Academy of Sciences"
https://openalex.org/F4320329833,Basic Scientific Fund for National Public Research Institutes of China
https://openalex.org/F4320335199,Korea Institute of Energy Technology Evaluation and Planning
https://openalex.org/F4320321604,Hubei University of Technology
https://openalex.org/F4320326691,Hebei University of Technology
https://openalex.org/F4320321041,Academia Sinica
https://openalex.org/F4320322845,National Health Research Institutes
https://openalex.org/F4320322182,Huaqiao University
https://openalex.org/F4320332235,Arizona Research Institute for Solar Energy
https://openalex.org/F4320336751,Science Foundation of Ministry of Education of China
https://openalex.org/F4320336172,"Ningbo Institute of Materials Technology and Engineering, Chinese Academy of Sciences"
https://openalex.org/F4320322867,Hong Kong Institute of Education
https://openalex.org/F4320335953,Jilin Scientific and Technological Development Program
https://openalex.org/F4320335855,Project of High-level Teachers in Beijing Municipal Universities in the Period of 13th Five-year Plan
https://openalex.org/F4320311028,Natural Science Foundation of Xinjiang Province
https://openalex.org/F4320327742,Széchenyi István Egyetem
https://openalex.org/F4320337145,"Hospitality and Tourism Research Centre, Hong Kong Polytechnic University"
https://openalex.org/F4320335789,National Key Clinical Specialty Discipline Construction Program of China
https://openalex.org/F4320313620,Hubei Provincial Department of Education
https://openalex.org/F4320318785,State Key Laboratory of Crystal Materials
https://openalex.org/F4320324310,Wuyi University
https://openalex.org/F4320324039,Politecnico di Milano
https://openalex.org/F4320326546,Fujian Normal University
https://openalex.org/F4320336549,Qianjiang Talents Fund of Zhejiang Province
https://openalex.org/F4320328637,Anhui Polytechnic University
https://openalex.org/F4320335406,University Natural Science Research Project of Anhui Province
https://openalex.org/F4320321181,Austrian Science Fund
https://openalex.org/F4320321949,Department of Education of Hebei Province
https://openalex.org/F4320322780,Universiti Teknologi MARA
https://openalex.org/F4320333998,"Shenzhen Research Institute, City University of Hong Kong"
https://openalex.org/F4320320004,British Academy
https://openalex.org/F4320319175,Wofoo Foundation
https://openalex.org/F4320326670,Chengdu Science and Technology Bureau
https://openalex.org/F4320325097,Högskolan Kristianstad
https://openalex.org/F4320335966,Science and Technology Planning Project of Shenzhen Municipality
https://openalex.org/F4320329865,Social Science Foundation of Jiangsu Province
https://openalex.org/F4320335690,State Key Laboratory of Solidification Processing
https://openalex.org/F4320321135,Chongqing University
https://openalex.org/F4320312742,Paleontological Research Institution
https://openalex.org/F4320321979,University of Surrey
https://openalex.org/F4320321739,Consejo Nacional de Ciencia y Tecnología
https://openalex.org/F4320336601,Major Science and Technology Projects in Anhui Province
https://openalex.org/F4320324852,Nanjing University
https://openalex.org/F4320320251,Royal Society of Chemistry
https://openalex.org/F4320324051,National Taipei University of Technology
https://openalex.org/F4320336101,"Faculty of Science, Agriculture and Engineering, Newcastle University"
https://openalex.org/F4320323383,Technische Universität München
https://openalex.org/F4320327051,Science and Technology Department of Henan Province
https://openalex.org/F4320311314,University of Hull
https://openalex.org/F4320335579,University Postgraduate Programme
https://openalex.org/F4320336625,Soft Science Research Project of Guangdong Province
https://openalex.org/F4320336836,Applied Basic Research Fund of Qingdao
https://openalex.org/F4320323539,Ministry of Human Resources and Social Security
https://openalex.org/F4320338281,Army Research Office
https://openalex.org/F4320316092,Science and Technology Department of Ningxia
https://openalex.org/F4320321557,Chulalongkorn University
https://openalex.org/F4320322817,National Research Council of Thailand
https://openalex.org/F4320329659,Thailand Science Research and Innovation
https://openalex.org/F4320330031,Science and Technology Department of Hubei Province
https://openalex.org/F4320330113,Hong Kong Branch of Southern Laboratory of Ocean Science and Engineering Guangdong Laboratory
https://openalex.org/F4320323021,Nankai University
https://openalex.org/F4320335617,State Key Laboratory of Rare Earth Resources Utilization
https://openalex.org/F4320322928,Danmarks Frie Forskningsfond
https://openalex.org/F4320330495,Southern Marine Science and Engineering Guangdong Laboratory (Guangzhou)
https://openalex.org/F4320335833,National Defense Basic Scientific Research Program of China
https://openalex.org/F4320324099,Russian Science Foundation
https://openalex.org/F4320337480,Basic Energy Sciences
https://openalex.org/F4320337646,Hydrogen and Fuel Cell Technologies Office
https://openalex.org/F4320334322,HORIZON EUROPE Framework Programme
https://openalex.org/F4320335254,Horizon 2020
https://openalex.org/F4320336768,Rijkswaterstaat
https://openalex.org/F4320320767,University Grants Commission
https://openalex.org/F4320306107,U.S. Environmental Protection Agency
https://openalex.org/F4320309883,Foundation for Cardiovascular Research
https://openalex.org/F4320328380,Instituto Nacional de Ciência e Tecnologia - Oceanografia Integrada e Usos Múltiplos da Plataforma Continental e Oceano Adjacente - Centro de Oceanografia Integrada
https://openalex.org/F4320328677,Hong Kong Hainan Commercial Association
https://openalex.org/F4320329534,Shenzhen Virtual University Park
https://openalex.org/F4320327926,National Key Basic Research Program For Youth
https://openalex.org/F4320323086,Natural Science Foundation of Liaoning Province
https://openalex.org/F4320327404,Dalian Maritime University
https://openalex.org/F4320313759,Tennessee Department of Transportation
https://openalex.org/F4320335555,Sunway University
https://openalex.org/F4320306084,U.S. Department of Energy
https://openalex.org/F4320338292,Lawrence Berkeley National Laboratory
https://openalex.org/F4320307848,International Monetary Fund
https://openalex.org/F4320307855,World Bank Group
https://openalex.org/F4320336581,Chunhui Project Foundation of the Education Department of China
https://openalex.org/F4320338075,Core Research for Evolutional Science and Technology
https://openalex.org/F4320338112,Exploratory Research for Advanced Technology
https://openalex.org/F4320322922,Department of Science and Technology of Sichuan Province
https://openalex.org/F4320325626,Education Department of Jiangxi Province
https://openalex.org/F4320327780,Key Research and Development Program of Jiangxi Province
https://openalex.org/F4320327721,K. C. Wong Education Foundation
https://openalex.org/F4320321881,Shanghai Municipal Education Commission
https://openalex.org/F4320324150,National University of Defense Technology
https://openalex.org/F4320321659,Shanghai Education Development Foundation
https://openalex.org/F4320319993,Leverhulme Trust
https://openalex.org/F4320324706,Saudi Aramco
https://openalex.org/F4320317552,Shanghai Tongji Gao Tingyao Environmental Science and Technology Development Foundation
https://openalex.org/F4320335576,Major International Joint Research Programme
https://openalex.org/F4320336584,Dalian Science and Technology Innovation Fund
https://openalex.org/F4320323268,Nanjing University of Posts and Telecommunications
https://openalex.org/F4320327562,Graduate Scientific Research and Innovation Foundation of Chongqing
https://openalex.org/F4320320431,Australian National University
https://openalex.org/F4320317593,Department of Transportation of Hunan Province
https://openalex.org/F4320327643,Kazan Federal University
https://openalex.org/F4320329913,RUDN University
https://openalex.org/F4320326911,State Key Laboratory of Polymer Materials Engineering
https://openalex.org/F4320324176,Changzhou Science and Technology Bureau
https://openalex.org/F4320313851,Shenzhen Polytechnic
https://openalex.org/F4320311227,Prince Sattam bin Abdulaziz University
https://openalex.org/F4320327514,Beijing Institute of Technology Research Fund Program for Young Scholars
https://openalex.org/F4320327031,State Key Laboratory for Disaster Reduction in Civil Engineering
https://openalex.org/F4320333852,"HIV and Drug Abuse Prevention Research Ethics Training Institute, Fordham University"
https://openalex.org/F4320306111,U.S. Department of Commerce
https://openalex.org/F4320329877,Bagui Scholars Program of Guangxi Zhuang Autonomous Region
https://openalex.org/F4320336630,Specific Research Project of Guangxi for Research Bases and Talents
https://openalex.org/F4320326483,European Organization for the Exploitation of Meteorological Satellites
https://openalex.org/F4320326745,State Key Laboratory of Marine Resource Utilization in South China Sea
https://openalex.org/F4320311026,Shandong University
https://openalex.org/F4320314731,UK Research and Innovation
https://openalex.org/F4320320366,European Cooperation in Science and Technology
https://openalex.org/F4320338337,H2020 Marie Skłodowska-Curie Actions
https://openalex.org/F4320336234,Beijing Synchrotron Radiation Facility
https://openalex.org/F4320336736,Chengdu Science and Technology Program
https://openalex.org/F4320331771,European Centre for Medium-Range Weather Forecasts
https://openalex.org/F4320318615,Zhejiang Office of Philosophy and Social Science
https://openalex.org/F4320335769,Graduate Research and Innovation Projects of Jiangsu Province
https://openalex.org/F4320313216,Yancheng Institute of Technology
https://openalex.org/F4320320698,National University of Singapore
https://openalex.org/F4320321605,Government of Jiangsu Province
https://openalex.org/F4320324785,Hainan Medical University
https://openalex.org/F4320326677,Education Department of Hainan Province
https://openalex.org/F4320336627,Special Fund Project for Science and Technology Innovation Strategy of Guangdong Province
https://openalex.org/F4320327605,Southern University of Science and Technology
https://openalex.org/F4320328112,Shanxi Provincial Education Department
https://openalex.org/F4320330171,SaskPower
https://openalex.org/F4320328086,"Bundesministerium für Bildung, Wissenschaft und Forschung"
https://openalex.org/F4320330170,Young Elite Scientists Sponsorship Program by Tianjin
https://openalex.org/F4320331257,Alliance de recherche numérique du Canada
https://openalex.org/F4320327476,Jiangxi Normal University
https://openalex.org/F4320336042,"West China Hospital, Sichuan University"
https://openalex.org/F4320335956,Key Technologies Research and Development Program of Guangzhou
https://openalex.org/F4320326962,Macau University of Science and Technology Foundation
https://openalex.org/F4320334112,Beijing Municipal Social Science Foundation
https://openalex.org/F4320319314,Materials and Life Science Experimental Facility
https://openalex.org/F4320323191,Nanjing University of Science and Technology
https://openalex.org/F4320331060,Sino-Danish Center
https://openalex.org/F4320316878,Natural Science Foundation of Changzhou City
https://openalex.org/F4320334724,Cancer Council Queensland
https://openalex.org/F4320329878,Central University Basic Research Fund of China
https://openalex.org/F4320313609,Guangdong Innovative and Entrepreneurial Research Team Program
https://openalex.org/F4320320875,Deutscher Akademischer Austauschdienst
https://openalex.org/F4320321410,Jiangsu University
https://openalex.org/F4320335965,Science and Technology Major Project of Guangxi
https://openalex.org/F4320324850,Guangdong University of Foreign Studies
https://openalex.org/F4320334534,"Research Institute for Science and Technology, Tokyo Denki University"
https://openalex.org/F4320322559,Southwest University of Science and Technology
https://openalex.org/F4320327069,Foshan University
https://openalex.org/F4320321630,Dalian University of Technology
https://openalex.org/F4320322730,Kementerian Pendidikan
https://openalex.org/F4320334974,Hebei Province Science and Technology Support Program
https://openalex.org/F4320335793,Academic Excellence Foundation of BUAA for PHD Students
https://openalex.org/F4320307239,Discovery Eye Foundation
https://openalex.org/F4320319853,"Ministry of Higher Education, Research and Innovation"
https://openalex.org/F4320321091,Coordenação de Aperfeiçoamento de Pessoal de Nível Superior
https://openalex.org/F4320322025,Conselho Nacional de Desenvolvimento Científico e Tecnológico
https://openalex.org/F4320322573,Sultan Qaboos University
https://openalex.org/F4320323353,Fundação de Apoio à Pesquisa e à Inovação Tecnológica do Estado de Sergipe
https://openalex.org/F4320323678,Fundação de Amparo à Ciência e Tecnologia do Estado de Pernambuco
https://openalex.org/F4320322423,Ministry of Water Resources
https://openalex.org/F4320326834,State Key Lab of Digital Manufacturing Equipment and Technology
https://openalex.org/F4320321550,Chongqing Science and Technology Commission
https://openalex.org/F4320323110,Beijing Institute of Technology
https://openalex.org/F4320322768,Natural Science Foundation of Guangxi Province
https://openalex.org/F4320335940,Henan Province University Innovation Talents Support Program
https://openalex.org/F4320318617,Sichuan Office of Philosophy and Social Science
https://openalex.org/F4320323380,Universiti Teknologi Petronas
https://openalex.org/F4320322323,King Fahd University of Petroleum and Minerals
https://openalex.org/F4320322379,Gottfried Wilhelm Leibniz Universität Hannover
https://openalex.org/F4320314248,Louisiana Department of Transportation and Development
https://openalex.org/F4320317609,Henan Provincial Department of Transportation
https://openalex.org/F4320309697,Alzheimer's Disease Neuroimaging Initiative
https://openalex.org/F4320329352,Organization Department of the Central Committee of the Communist Party of China
https://openalex.org/F4320336698,Overseas Expertise Introduction Center for Discipline Innovation of Food Nutrition and Human Health (111 Center)
https://openalex.org/F4320328373,National Key Laboratory Foundation of China
https://openalex.org/F4320327002,State Key Laboratory of Urban Water Resource and Environment
https://openalex.org/F4320322666,Natural Science Foundation of Shanxi Province
https://openalex.org/F4320328779,National Foundation of Elites
https://openalex.org/F4320330215,Natural Science Foundation for Distinguished Young Scholars of Hunan Province
https://openalex.org/F4320327720,Foundation for Innovative Research Groups of the National Natural Science Foundation of China
https://openalex.org/F4320322360,Kyushu University
https://openalex.org/F4320321864,Generalitat Valenciana
https://openalex.org/F4320335322,European Regional Development Fund
https://openalex.org/F4320321913,Beijing University of Technology
https://openalex.org/F4320321372,Konkuk University
https://openalex.org/F4320330733,National Asthma Council Australia
https://openalex.org/F4320312071,"Ministry of Education, Libya"
https://openalex.org/F4320326182,Six Talent Peaks Project in Jiangsu Province
https://openalex.org/F4320318339,Hang Seng University of Hong Kong
https://openalex.org/F4320323068,Beijing Postdoctoral Science Foundation
https://openalex.org/F4320327077,Bureau of Science and Technology of Jiangmen Municipality
https://openalex.org/F4320323799,Syddansk Universitet
https://openalex.org/F4320322731,Ministry of Education of the Republic of Belarus
https://openalex.org/F4320335681,Key Laboratory of Industrial Ecology and Environmental Engineering of the Ministry of Education
https://openalex.org/F4320322440,Ocean University of China
https://openalex.org/F4320326189,Taishan Scholar Project of Shandong Province
https://openalex.org/F4320336653,Science and Technology Support Plan for Youth Innovation of Colleges and Universities of Shandong Province of China
https://openalex.org/F4320330915,Beijing International Studies University
https://openalex.org/F4320326943,State Key Laboratory of Advanced Technology for Materials Synthesis and Processing
https://openalex.org/F4320328885,Young Talent Support Program of Shaanxi Province University
https://openalex.org/F4320327078,Taizhou Municipal Science and Technology Bureau
https://openalex.org/F4320329360,Taizhou University
https://openalex.org/F4320334145,Sichuan Association for Science and Technology
https://openalex.org/F4320318398,Ant Group
https://openalex.org/F4320322927,Zhejiang University
https://openalex.org/F4320335892,Youth Innovation Promotion Association
https://openalex.org/F4320323485,China Academy of Chinese Medical Sciences
https://openalex.org/F4320336475,National Safety Academic Fund
https://openalex.org/F4320310013,North Carolina State University
https://openalex.org/F4320323711,Southwest University
https://openalex.org/F4320327599,Central Universities in China
https://openalex.org/F4320324778,Ningbo Municipal Bureau of Science and Technology
https://openalex.org/F4320325777,Università degli Studi della Campania Luigi Vanvitelli
https://openalex.org/F4320324856,Southeast University
https://openalex.org/F4320336613,Science and Technology Innovation Talents in Universities of Henan Province
https://openalex.org/F4320320971,Monash University
https://openalex.org/F4320322449,Tongji University
